"created_at","id_str","full_text","quote_count","reply_count","retweet_count","favorite_count","lang","user_id_str","conversation_id_str","username","tweet_url","image_url","location"
"Fri Jan 26 03:22:03 +0000 2024","1750720728960569762","Bersama Prabowo-Gibran  kita yakin Indonesia akan menjadi negara yang berwibawa dan berkeadilan.   #YukSemuaPilih02 PakBowoMasGib YangTerbaik https://t.co/bEj2Z07g6u","0","0","0","0","in","1655181026594033668","1750720728960569762","_agussuganda","https://twitter.com/_agussuganda/status/1750720728960569762","https://pbs.twimg.com/media/GEvPN9Qa8AAjrO3.jpg","Tanah Sareal, Indonesia"
"Fri Jan 26 03:22:00 +0000 2024","1750720715794600098","Dalam perjalanan bersama Prabowo-Gibran  kita menemukan kekuatan untuk berubah.   #YukSemuaPilih02 PakBowoMasGib YangTerbaik https://t.co/nroFrBq4gN","0","0","0","0","in","1652321433664765952","1750720715794600098","agungprayoo","https://twitter.com/agungprayoo/status/1750720715794600098","https://pbs.twimg.com/ext_tw_video_thumb/1750720656302653440/pu/img/yp8xCFJxegTjob7l.jpg","Boyolali, Indonesia"
"Fri Jan 26 03:21:59 +0000 2024","1750720714645397696","semangat terus untuk mendukung pasangan Prabowo Gibran  bismillah menang satu putaran #JatengGasPolll https://t.co/VuSsORvusN","0","0","0","0","in","1712503193077440512","1750720714645397696","FArip28761","https://twitter.com/FArip28761/status/1750720714645397696","https://pbs.twimg.com/media/GEvPNCHbMAA0qAq.jpg",""
"Fri Jan 26 03:21:56 +0000 2024","1750720699373850824","Gimmick yang dilakukan oleh Gibran terasa seperti tirai yang menutupi kebodohannya dalam merumuskan solusi bagi bangsa ini @ellssaaa_rrrr https://t.co/S5laMt1lsO","0","0","0","0","in","1673620507214901250","1750720699373850824","AbdoelSusanto","https://twitter.com/AbdoelSusanto/status/1750720699373850824","https://pbs.twimg.com/ext_tw_video_thumb/1750720672106758144/pu/img/usYUOpZVfY20Eglw.jpg","Jakarta Selatan"
"Fri Jan 26 03:22:01 +0000 2024","1750720722920681641","Prabowo-Gibran  pilihan yang berani untuk menghadapi tantangan masa depan!   #YukSemuaPilih02 PakBowoMasGib YangTerbaik https://t.co/50D2m1pEvo","0","0","0","0","in","1729432298846924800","1750720722920681641","UmifsWidiastuti","https://twitter.com/UmifsWidiastuti/status/1750720722920681641","https://pbs.twimg.com/ext_tw_video_thumb/1750720659091767296/pu/img/f6ygwukBqzopbuo-.jpg","Kepulauan Selayar"
"Fri Jan 26 03:21:57 +0000 2024","1750720702716789039","Kebersamaan dalam masyarakat  Prabowo-Gibran adalah jalan menuju kemajuan.   #YukSemuaPilih02 PakBowoMasGib YangTerbaik https://t.co/zgM5DWz4BL","0","0","0","0","in","1697869820346384384","1750720702716789039","nugraha_hahahay","https://twitter.com/nugraha_hahahay/status/1750720702716789039","https://pbs.twimg.com/ext_tw_video_thumb/1750720595720040448/pu/img/8eUlRwiDYpmpBOJh.jpg","Jakarta Capital Region, Indone"
"Fri Jan 26 03:21:58 +0000 2024","1750720710719439324","Momentum ini menjadi bukti bahwa Prabowo-Gibran adalah pasangan yang serius dalam membangun masa depan yang lebih baik.   #YukSemuaPilih02 PakBowoMasGib YangTerbaik https://t.co/TOiKLbNcSI","0","0","0","0","in","1728249162821672960","1750720710719439324","KeziadmNugroho","https://twitter.com/KeziadmNugroho/status/1750720710719439324","https://pbs.twimg.com/ext_tw_video_thumb/1750720667635560448/pu/img/cSYlx536Oz_o_vYz.jpg","Wajo, Sulawesi Selatan"
"Fri Jan 26 03:21:57 +0000 2024","1750720705937932565","Suara kita  kekuatan untuk mencapai perubahan: Prabowo-Gibran.   #YukSemuaPilih02 PakBowoMasGib YangTerbaik https://t.co/5T3cCtbuP0","0","0","0","0","in","1737367409340895232","1750720705937932565","MakaraqhNasyiah","https://twitter.com/MakaraqhNasyiah/status/1750720705937932565","https://pbs.twimg.com/ext_tw_video_thumb/1750720606897938432/pu/img/PrPHrN6M5v7wOmM-.jpg","Tanjung Jabung Barat"
"Fri Jan 26 03:22:44 +0000 2024","1750720899991638017","Gimmick adalah senjata andalan Gibran karena substansi politiknya rapuh dan tak berdaya @eclairyc https://t.co/IYdUEW40cC","0","0","0","0","in","1675776517291515904","1750720899991638017","rzkydwinat","https://twitter.com/rzkydwinat/status/1750720899991638017","https://pbs.twimg.com/ext_tw_video_thumb/1750720858098900992/pu/img/Erhk7E6MIHIoJhsk.jpg","Jambi"
"Fri Jan 26 03:22:43 +0000 2024","1750720899794468991","Prabowo-Gibran  satu pasangan  satu tujuan: kemenangan dalam satu putaran!   #YukSemuaPilih02 PakBowoMasGib YangTerbaik https://t.co/x3FR54rWkG","0","0","0","0","in","1717804899189317632","1750720899794468991","GKamilania","https://twitter.com/GKamilania/status/1750720899794468991","https://pbs.twimg.com/ext_tw_video_thumb/1750720872883843072/pu/img/CppQC3K_CWZ8c1zd.jpg",""
"Fri Jan 26 03:22:44 +0000 2024","1750720900855742710","Masyarakat percaya bahwa Prabowo-Gibran adalah tandem yang dapat merumuskan kebijakan-kebijakan progresif untuk mewujudkan kemajuan bangsa.   #YukSemuaPilih02 PakBowoMasGib YangTerbaik https://t.co/WKjsfdHYjA","0","0","0","0","in","1724415061027098624","1750720900855742710","SasMariska","https://twitter.com/SasMariska/status/1750720900855742710","https://pbs.twimg.com/media/GEvPYLmacAEheDc.jpg","Bandung Wetan, Indonesia"
"Fri Jan 26 03:22:42 +0000 2024","1750720894509728188","Prabowo-Gibran  pemimpin yang berkomitmen untuk kesejahteraan rakyat.   #YukSemuaPilih02 PakBowoMasGib YangTerbaik https://t.co/FXnlLk13wJ","0","0","0","0","in","1715570725359439872","1750720894509728188","CMongstar37664","https://twitter.com/CMongstar37664/status/1750720894509728188","https://pbs.twimg.com/ext_tw_video_thumb/1750720854345072640/pu/img/aPB2fYpDaNAitf9t.jpg","Brebes, Indonesia"
"Fri Jan 26 03:22:42 +0000 2024","1750720893511463386","Keberhasilan Prabowo-Gibran dalam mencapai prestasi merupakan bukti kompetensinya sebagai pemimpin.   #YukSemuaPilih02 PakBowoMasGib YangTerbaik https://t.co/yaRduLPY6A","0","0","0","0","in","1719307432030281728","1750720893511463386","INasyidah79134","https://twitter.com/INasyidah79134/status/1750720893511463386","https://pbs.twimg.com/ext_tw_video_thumb/1750720827186937856/pu/img/3B7sxJE4yHn4iwrp.jpg","bandung"
"Fri Jan 26 03:22:44 +0000 2024","1750720902017519669","Kebersamaan dalam masyarakat  Prabowo-Gibran adalah jalan menuju kemajuan.   #YukSemuaPilih02 PakBowoMasGib YangTerbaik https://t.co/J191VdgmDA","0","0","0","0","in","1742732078062710784","1750720902017519669","GangsaraxSaeful","https://twitter.com/GangsaraxSaeful/status/1750720902017519669","https://pbs.twimg.com/media/GEvPXwkaEAA2XD3.jpg","Bululawang, Indonesia"
"Fri Jan 26 03:22:40 +0000 2024","1750720885789716673","Prabowo-Gibran  pemimpin yang mampu mengatasi berbagai permasalahan bangsa.   #YukSemuaPilih02 PakBowoMasGib YangTerbaik https://t.co/OI0upUM6jI","0","0","0","0","in","1651511469824184321","1750720885789716673","purwasih_3005","https://twitter.com/purwasih_3005/status/1750720885789716673","https://pbs.twimg.com/ext_tw_video_thumb/1750720604163207169/pu/img/yfHZWlg5EEyIIxbe.jpg","Depok, Jawa Barat"
"Fri Jan 26 03:22:42 +0000 2024","1750720894702592052","Dalam Prabowo-Gibran  terpancar sinar keberanian dan keadilan untuk Indonesia.   #YukSemuaPilih02 PakBowoMasGib YangTerbaik https://t.co/kxX9bqfHYW","0","0","0","0","in","1729881409547087873","1750720894702592052","BahuwarnakjUsam","https://twitter.com/BahuwarnakjUsam/status/1750720894702592052","https://pbs.twimg.com/media/GEvPXuLaAAAtFhO.jpg","Pasuruan"
"Fri Jan 26 03:22:42 +0000 2024","1750720895021453524","Satu putaran kemenangan untuk Prabowo-Gibran  mari kita bergerak bersama.   #YukSemuaPilih02 PakBowoMasGib YangTerbaik https://t.co/ERr0WAtT1G","0","0","0","0","in","1688435605813010432","1750720895021453524","maiamaria2_","https://twitter.com/maiamaria2_/status/1750720895021453524","https://pbs.twimg.com/media/GEvPXsJa0AAVN_C.jpg","Malang, Jawa Timur"
"Fri Jan 26 03:22:39 +0000 2024","1750720882467815862","Prabowo-Gibran  sinergi untuk kemajuan bangsa.   #YukSemuaPilih02 PakBowoMasGib YangTerbaik https://t.co/4tPlOdKIFC","0","0","0","0","in","1706586847311433728","1750720882467815862","ferryromando","https://twitter.com/ferryromando/status/1750720882467815862","https://pbs.twimg.com/ext_tw_video_thumb/1750720826259980288/pu/img/LVB5sq_oey8g3IYi.jpg","Setia Budi, Indonesia"
"Fri Jan 26 03:22:38 +0000 2024","1750720876629409866","Ketergantungan pada gimmick menunjukkan bahwa Gibran tidak mampu bersaing dalam arena politik tanpa bantuan palsu @emrnmhd_ https://t.co/4QwTKeHEes","0","0","0","0","in","1673218417132994560","1750720876629409866","wahyuniii110","https://twitter.com/wahyuniii110/status/1750720876629409866","https://pbs.twimg.com/ext_tw_video_thumb/1750720844836618241/pu/img/oU51LXMui2aGlLSK.jpg","Tangerang Selatan"
"Fri Jan 26 03:22:38 +0000 2024","1750720878068044181","Prabowo-Gibran hadir dengan semangat baru untuk memajukan bangsa dan negara.   #YukSemuaPilih02 PakBowoMasGib YangTerbaik https://t.co/bQf7ax7fLW","0","0","0","0","in","1719270348657684480","1750720878068044181","ErnesElsa","https://twitter.com/ErnesElsa/status/1750720878068044181","https://pbs.twimg.com/media/GEvPW4fasAALkyb.jpg","Slawi, Indonesia"
"Fri Jan 26 03:22:40 +0000 2024","1750720885219282980","Bersama Prabowo-Gibran  kita bisa menciptakan perubahan positif. Mari perkuat dukungan kita!   #YukSemuaPilih02 PakBowoMasGib YangTerbaik https://t.co/xi6OGtNh9u","0","0","0","0","in","1725479680709705728","1750720885219282980","AriKencono","https://twitter.com/AriKencono/status/1750720885219282980","https://pbs.twimg.com/ext_tw_video_thumb/1750720803900153856/pu/img/cnDxV6ZQ_dO2IZVC.jpg","Cilacap jawa tengah"
"Fri Jan 26 03:22:40 +0000 2024","1750720886771175588","Dukungan yang semakin meluas untuk Prabowo-Gibran menunjukkan bahwa mereka adalah pilihan yang diharapkan oleh banyak orang.   #YukSemuaPilih02 PakBowoMasGib YangTerbaik https://t.co/UayyVOV0Xu","0","0","0","0","in","1701477907259101184","1750720886771175588","sandraalfiansya","https://twitter.com/sandraalfiansya/status/1750720886771175588","https://pbs.twimg.com/media/GEvPXLvboAARHkI.jpg","Jagakarsa, Indonesia"
"Fri Jan 26 03:22:42 +0000 2024","1750720892483870753","Prabowo-Gibran adalah pilihan kita untuk Indonesia yang lebih baik.   #YukSemuaPilih02 PakBowoMasGib YangTerbaik https://t.co/7ZEBsWlvuX","0","0","0","0","in","1686309286325215232","1750720892483870753","JunikaRiri","https://twitter.com/JunikaRiri/status/1750720892483870753","https://pbs.twimg.com/media/GEvPXm_a4AA-qaV.jpg","DKI Jakarta, Indonesia"
"Fri Jan 26 03:22:40 +0000 2024","1750720884707565977","Prabowo-Gibran  pemimpin yang mampu mengatasi berbagai isu bangsa.   #YukSemuaPilih02 PakBowoMasGib YangTerbaik https://t.co/NUvDGuKNez","0","0","0","0","in","1705065754411094016","1750720884707565977","angellpetrra","https://twitter.com/angellpetrra/status/1750720884707565977","https://pbs.twimg.com/media/GEvPW3Ya0AASDJA.jpg","Batu Ceper, Indonesia"
"Fri Jan 26 03:22:38 +0000 2024","1750720878416199741","Bersama Prabowo-Gibran  kita akan membangun Indonesia emas yang menjadi kebanggaan kita semua.   #YukSemuaPilih02 PakBowoMasGib YangTerbaik https://t.co/IOpP19Tccs","0","0","0","0","in","1702252296946741248","1750720878416199741","CFauzia72","https://twitter.com/CFauzia72/status/1750720878416199741","https://pbs.twimg.com/ext_tw_video_thumb/1750720722681634816/pu/img/WG0KFPj0GMj9gCxj.jpg","Jakarta Capital Region, Indone"
"Fri Jan 26 03:22:40 +0000 2024","1750720883281605067","Mari bersama Prabowo-Gibran  membangun Indonesia yang inklusif dan berkeadilan.   #YukSemuaPilih02 PakBowoMasGib YangTerbaik https://t.co/fKm3m82yHF","0","0","0","0","in","1719655949689077760","1750720883281605067","karimmhastutih","https://twitter.com/karimmhastutih/status/1750720883281605067","https://pbs.twimg.com/media/GEvPW5FbgAAkbHm.jpg","Surakarta, Jawa Tengah"
"Fri Jan 26 03:22:41 +0000 2024","1750720891271717172","Bersama Prabowo-Gibran  mari kita perjuangkan hak-hak rakyat Indonesia dengan sepenuh hati!   #YukSemuaPilih02 PakBowoMasGib YangTerbaik https://t.co/Rv554vklUp","0","0","0","0","in","1653333274801090560","1750720891271717172","AtihMirawati","https://twitter.com/AtihMirawati/status/1750720891271717172","https://pbs.twimg.com/media/GEvPXoybcAAB2Rh.jpg","Banyumas, Indonesia"
"Fri Jan 26 03:22:42 +0000 2024","1750720891644727484","Semangat rakyat semakin padu dalam memilih Prabowo-Gibran untuk membawa kemakmuran.   #YukSemuaPilih02 PakBowoMasGib YangTerbaik https://t.co/MEjCYFHv4u","0","0","0","0","in","1701163466462248960","1750720891644727484","hilmanmust_","https://twitter.com/hilmanmust_/status/1750720891644727484","https://pbs.twimg.com/media/GEvPXT8aUAAveMV.jpg","Pondok Aren, Indonesia"
"Fri Jan 26 03:22:48 +0000 2024","1750720918564045190","Bersama Prabowo-Gibran  kita bisa membangun Indonesia yang lebih baik. Mari perkuat dukungan kita!   #YukSemuaPilih02 PakBowoMasGib YangTerbaik https://t.co/RfPifHWTlf","0","0","0","0","in","1719229739783831552","1750720918564045190","MalikaOkta12856","https://twitter.com/MalikaOkta12856/status/1750720918564045190","https://pbs.twimg.com/ext_tw_video_thumb/1750720835126763520/pu/img/Y3PZtQIS0OHUwb-3.jpg","cianjur"
"Fri Jan 26 03:22:47 +0000 2024","1750720912566124550","Dalam satu putaran  Prabowo-Gibran membawa perubahan untuk memajukan bangsa dan kesejahteraan rakyat.   #YukSemuaPilih02 PakBowoMasGib YangTerbaik https://t.co/zi3VqcvWCh","0","0","0","0","in","1706585151051030528","1750720912566124550","farelpaul16","https://twitter.com/farelpaul16/status/1750720912566124550","https://pbs.twimg.com/ext_tw_video_thumb/1750720830143856640/pu/img/z5wnC57U3Fm7YJlu.jpg","Jakarta Capital Region, Indone"
"Fri Jan 26 03:22:48 +0000 2024","1750720917075034410","Pilihan yang bijaksana  Prabowo-Gibran adalah pemimpin yang mampu memberikan solusi terbaik.   #YukSemuaPilih02 PakBowoMasGib YangTerbaik https://t.co/fdPWZItaaq","0","0","0","0","in","1717749268939952128","1750720917075034410","miaprat791","https://twitter.com/miaprat791/status/1750720917075034410","https://pbs.twimg.com/ext_tw_video_thumb/1750720820538925056/pu/img/hEKJgv5NHjHyMCBJ.jpg","Ungaran, Indonesia"
"Fri Jan 26 03:22:45 +0000 2024","1750720906249502861","Dukungan masyarakat buat Prabowo-Gibran  mantap abis!   #YukSemuaPilih02 PakBowoMasGib YangTerbaik https://t.co/FleF4E7vKr","0","0","0","0","in","1701869644561485824","1750720906249502861","kenzisaputr","https://twitter.com/kenzisaputr/status/1750720906249502861","https://pbs.twimg.com/ext_tw_video_thumb/1750720745536401408/pu/img/hjOTk15vtVsTbvP1.jpg","Setia Budi, Indonesia"
"Fri Jan 26 03:22:47 +0000 2024","1750720913681822072","Gibranscape  dunia khayalan yang dibangun oleh Gibran karena keterbatasan ide dan gagasannya @ElJuli36342142 https://t.co/BkJSSd3A92","0","0","0","0","in","1676108298163200001","1750720913681822072","SuparminSae","https://twitter.com/SuparminSae/status/1750720913681822072","https://pbs.twimg.com/ext_tw_video_thumb/1750720883830964224/pu/img/g-MTqpX7H497e3Fq.jpg","Batu"
"Fri Jan 26 03:22:47 +0000 2024","1750720913073676694","Dukung Prabowo-Gibran agar Indonesia maju dan rakyat sejahtera dalam satu putaran.   #YukSemuaPilih02 PakBowoMasGib YangTerbaik https://t.co/fC5imRC1BH","0","0","0","0","in","1725772312048238592","1750720913073676694","KleinVina27699","https://twitter.com/KleinVina27699/status/1750720913073676694","https://pbs.twimg.com/ext_tw_video_thumb/1750720871961071616/pu/img/vCU3msLZj-PBWKgU.jpg","Klaten, Jawa Tengah"
"Fri Jan 26 03:22:48 +0000 2024","1750720917213429977","Bersama Prabowo-Gibran  kita bangun Indonesia yang lebih adil dan sejahtera!   #YukSemuaPilih02 PakBowoMasGib YangTerbaik https://t.co/ixVVOcKiIz","0","0","0","0","in","1654035312270794752","1750720917213429977","Susilawati_ucah","https://twitter.com/Susilawati_ucah/status/1750720917213429977","https://pbs.twimg.com/media/GEvPY2DbkAA8OdT.jpg",""
"Fri Jan 26 03:22:47 +0000 2024","1750720912561979635","Dukungan untuk Prabowo-Gibran semakin kuat  menunjukkan bahwa mereka adalah pasangan yang diharapkan oleh banyak orang.   #YukSemuaPilih02 PakBowoMasGib YangTerbaik https://t.co/jWFFXqY19O","0","0","0","0","in","1704747942949875712","1750720912561979635","dzaki_amir","https://twitter.com/dzaki_amir/status/1750720912561979635","https://pbs.twimg.com/ext_tw_video_thumb/1750720828998819840/pu/img/DSQMQXVIc7rThb7b.jpg","Penjaringan, Indonesia"
"Fri Jan 26 03:22:37 +0000 2024","1750720874205118534","Bersama Prabowo-Gibran  kita bisa meraih cita-cita emas Indonesia.   #YukSemuaPilih02 PakBowoMasGib YangTerbaik https://t.co/WHXxJZ8tNQ","0","0","0","0","in","1717836496437456896","1750720874205118534","noera_nura","https://twitter.com/noera_nura/status/1750720874205118534","https://pbs.twimg.com/ext_tw_video_thumb/1750720809696722944/pu/img/aZ0WN2p4qiEYHtLO.jpg","Klaten, Jawa Tengah"
"Fri Jan 26 03:22:41 +0000 2024","1750720887387820293","Masyarakat berharap  Prabowo-Gibran akan menjadi katalisator perubahan positif untuk negeri ini.   #YukSemuaPilih02 PakBowoMasGib YangTerbaik https://t.co/A1TkAGH2bv","0","0","0","0","in","1720641458817105920","1750720887387820293","d_man_dandan","https://twitter.com/d_man_dandan/status/1750720887387820293","https://pbs.twimg.com/media/GEvPXT3bkAA5CUc.jpg","bandung, Indonesia."
"Thu Jan 25 10:00:12 +0000 2024","1750458538940575890","Sederhana sih hanya bantu kenakan jaket ❤️  Tapi itulah kolaborasi  tidak sibuk sendiri-sendiri.  Pak Prabowo Pak Jokowi ❤️ Mas Gibran Pak Prabowo ❤️ Semuanya kesayangan rakyat Indonesia  lebih besar daripada sekedar rakyat  partai .. https://t.co/ffgJgaIHUq","6","21","69","228","in","1219890224936783874","1750458538940575890","NyaiiBubu","https://twitter.com/NyaiiBubu/status/1750458538940575890","https://pbs.twimg.com/ext_tw_video_thumb/1750458496087445504/pu/img/Ixjw1Fsm4M2_4NRK.jpg","💕"
"Fri Jan 26 01:53:38 +0000 2024","1750698480694440095","GIBRAN memang norak 🤣","0","1","3","16","in","99743594","1750698480694440095","ike_hw71","https://twitter.com/ike_hw71/status/1750698480694440095","","Malang, Jawa Timur"
"Thu Jan 25 08:56:25 +0000 2024","1750442488232624465","Kalau Bpk @jokowi mau Kampanye dukung Prabowo-Gibran silahkan jangan malu2  toh semuanya sudah jelas baik secara UU dan Etika sebagai Presiden. Ayoo pak @jokowi saya dukung Bpk Kampanye terbuka   biar jrlas dan terang. 👉Nitip Bansos jgn dibuat Kampanye ya pak🙏🙏🙏 uang Rakyat. https://t.co/ni62Gh0JBn","3","38","51","232","in","1167268507282591744","1750442488232624465","HmfaqihA","https://twitter.com/HmfaqihA/status/1750442488232624465","https://pbs.twimg.com/media/GErSKl2bEAEaF0N.jpg",""
"Fri Jan 26 03:01:33 +0000 2024","1750715570495139958","Mas Gibran dengar aspirasi ribuan warga di Kebumen  dari nelayan hingga milenial  dalam acara Bersholawat. Izin dan doa untuk terus lanjutkan pembangunan Indonesia ke depan. 🇮🇩 #GibranBerkarya #BersamaIndonesiaMaju  #SaatnyaPindahKe02 KamuKITA PbowoGBRAN  14FebKeTPS UntukPAKBowo https://t.co/tWmLEi8IwQ","0","0","2","3","in","1719243505577693184","1750715570495139958","menangkanrakyat","https://twitter.com/menangkanrakyat/status/1750715570495139958","https://pbs.twimg.com/media/GEvKPhRawAAZJ7a.jpg","Jakarta Pusat, DKI Jakarta"
"Thu Jan 25 10:44:18 +0000 2024","1750469638578991536","Nah udah dibikin gratis nih bang @gibran_tweet   Gak perlu pinjam seratus lagi.","14","109","874","9216","in","1495326248100589569","1750469638578991536","neohistoria_id","https://twitter.com/neohistoria_id/status/1750469638578991536","","Jakarta Selatan, DKI Jakarta"
"Fri Jan 26 03:00:00 +0000 2024","1750715181183971679","Paslon no 2 @prabowo Gibran semakin mndapatkan dukungan besar di beberapa wilayah kunci  terutama di wilayah JawaTengah. Wilayah yg sblmnya pdip kini bisa di satukan dgn koalisi prabowo gibran  ini pasti krn rakyat percaya &amp; suka dngn visi misi paslon 2 @tvOneNews #JatengGasPolll https://t.co/EYwOwxW2cr","0","0","1","0","in","1261226882369871874","1750715181183971679","missriantiii","https://twitter.com/missriantiii/status/1750715181183971679","https://pbs.twimg.com/media/GEs0Gzia4AAQvil.jpg","Indonesia"
"Fri Jan 26 03:22:30 +0000 2024","1750720841439138127","Prabowo-Gibran adalah pemimpin yang berkomitmen untuk kemajuan bangsa.   #YukSemuaPilih02 PakBowoMasGib YangTerbaik https://t.co/xi7q345MDw","0","0","0","0","in","1718811585358274560","1750720841439138127","AAerilyn1","https://twitter.com/AAerilyn1/status/1750720841439138127","https://pbs.twimg.com/media/GEvPUvzbsAAF1Hz.jpg","Boyolali, Indonesia"
"Fri Jan 26 03:22:30 +0000 2024","1750720841246286109","Bersama Prabowo-Gibran  kita bisa menciptakan perubahan yang berarti.   #YukSemuaPilih02 PakBowoMasGib YangTerbaik https://t.co/N8oGz15hp1","0","0","0","0","in","1706153812552200192","1750720841246286109","aprilmoon1004","https://twitter.com/aprilmoon1004/status/1750720841246286109","https://pbs.twimg.com/ext_tw_video_thumb/1750720804629938176/pu/img/VFtntF7roIrZpCp0.jpg","Pekalongan, Indonesia"
"Thu Jan 25 08:50:23 +0000 2024","1750440968351007001","Nusron Wahid tidak pernah henti mengajak masyarakat untuk memberikan dukungan kepada pasangan prabowo gibran untuk bisa memenangkan kontestasi dalam sekali putaran  #Dapil2JatengAllin02 https://t.co/4LWpVdt9W7","29","41","42","48","in","855009252103958529","1750440968351007001","Sohheex","https://twitter.com/Sohheex/status/1750440968351007001","https://pbs.twimg.com/media/GErQyLQaAAAJq8L.jpg",""
"Thu Jan 25 14:54:59 +0000 2024","1750532723788349609","Gibran belum terpilih saja  pendukungnya sudah kayak begini kelakuannya.  Gimana nanti saat terpilih coba? Kritik dikit dilaporin    meski gak ada pasalnya","2","1","82","189","in","42582927","1750532723788349609","tunggalp","https://twitter.com/tunggalp/status/1750532723788349609","","Jakarta Capital Region"
"Fri Jan 26 03:22:55 +0000 2024","1750720948830122010","Prabowo-Gibran  pilihan yang tepat untuk memimpin Indonesia ke arah yang lebih baik.   #YukSemuaPilih02 PakBowoMasGib YangTerbaik https://t.co/GSlP8RHbj5","0","0","0","0","in","1701147981561634816","1750720948830122010","TintoAlvin","https://twitter.com/TintoAlvin/status/1750720948830122010","https://pbs.twimg.com/ext_tw_video_thumb/1750720882878865408/pu/img/fg_03Uy9DE5UshcM.jpg","Tangerang, Indonesia"
"Fri Jan 26 03:22:49 +0000 2024","1750720923433615681","Gibran terlihat seperti aktor yang kehilangan naskah dan hanya bisa mengandalkan gimmick untuk tetap berada di atas panggung @dicebigwin https://t.co/KU1LlUBNFG","0","0","0","0","in","1674293267821920257","1750720923433615681","sayunda1_","https://twitter.com/sayunda1_/status/1750720923433615681","https://pbs.twimg.com/ext_tw_video_thumb/1750720811978358784/pu/img/rYLXfKXnYTbnSRem.jpg","jakarta selatan"
"Fri Jan 26 03:22:53 +0000 2024","1750720941632676075","Setiap kali Gibran berbicara tentang visi-misinya  gimmicknya seolah-olah menenggelamkan kata-katanya dalam lautan ketidakjelasan @elnyaer https://t.co/JhkAMLQH04","0","0","0","0","in","1676135998345076736","1750720941632676075","FaizalAzimaa","https://twitter.com/FaizalAzimaa/status/1750720941632676075","https://pbs.twimg.com/ext_tw_video_thumb/1750720899446411264/pu/img/tgO4BGSNzJ6wpUvg.jpg","Singkawang"
"Fri Jan 26 03:22:55 +0000 2024","1750720946959527951","Ayo  kita bersatu suara untuk mendukung Prabowo-Gibran! Mereka adalah harapan kita.   #YukSemuaPilih02 PakBowoMasGib YangTerbaik https://t.co/pERuoSFyqm","0","0","0","0","in","1701423450106277888","1750720946959527951","hermawanfaa","https://twitter.com/hermawanfaa/status/1750720946959527951","https://pbs.twimg.com/ext_tw_video_thumb/1750720895948353536/pu/img/6cp7YAuc8IjZqxSn.jpg","Lamongan, Indonesia"
"Fri Jan 26 03:22:52 +0000 2024","1750720935165108596","Satu putaran untuk kesejahteraan  satu pilihan untuk kemajuan: Prabowo-Gibran!   #YukSemuaPilih02 PakBowoMasGib YangTerbaik https://t.co/QrvECAo0Zp","0","0","0","0","in","1724725201630531584","1750720935165108596","Great_Abay","https://twitter.com/Great_Abay/status/1750720935165108596","https://pbs.twimg.com/media/GEvPZzubYAAeR1e.jpg","Kudus, Indonesia"
"Fri Jan 26 03:22:53 +0000 2024","1750720940080799818","Satu hati  satu suara: Prabowo-Gibran  pilihan bijak kita.   #YukSemuaPilih02 PakBowoMasGib YangTerbaik https://t.co/lgjzWwRcup","0","0","0","0","in","1704691543213502464","1750720940080799818","lesti1159259","https://twitter.com/lesti1159259/status/1750720940080799818","https://pbs.twimg.com/ext_tw_video_thumb/1750720870866382848/pu/img/2Izr9RF3G6ohowK1.jpg","Jember, Jawa Timur"
"Fri Jan 26 03:22:52 +0000 2024","1750720937337782348","Satu perjuangan  satu pilihan: Prabowo-Gibran pemimpin yang diharapkan bersama.   #YukSemuaPilih02 PakBowoMasGib YangTerbaik https://t.co/im6mCeTvkD","0","0","0","0","in","1718914453767675904","1750720937337782348","RAwliyariri","https://twitter.com/RAwliyariri/status/1750720937337782348","https://pbs.twimg.com/ext_tw_video_thumb/1750720906979340288/pu/img/nsRWHB8t-aCJ9kFc.jpg","Semarang, Jawa Tengah"
"Fri Jan 26 03:22:53 +0000 2024","1750720940907057548","Visi dan misi Prabowo-Gibran adalah solusi untuk mengatasi berbagai masalah yang dihadapi negara.   #YukSemuaPilih02 PakBowoMasGib YangTerbaik https://t.co/H0XbvzOMKD","0","0","0","0","in","1656493049525186561","1750720940907057548","aryanifina801","https://twitter.com/aryanifina801/status/1750720940907057548","https://pbs.twimg.com/ext_tw_video_thumb/1750720887631040512/pu/img/612rUnuyySHzF5e-.jpg","Bogor Selatan, Indonesia"
"Fri Jan 26 03:22:54 +0000 2024","1750720945868997054","Solidaritas kita bersama Prabowo-Gibran  untuk Indonesia yang lebih sejahtera.   #YukSemuaPilih02 PakBowoMasGib YangTerbaik https://t.co/2uJGymSTJA","0","0","0","0","in","1705464420942610433","1750720945868997054","OTamaka65002","https://twitter.com/OTamaka65002/status/1750720945868997054","https://pbs.twimg.com/media/GEvPaYsbgAAvqhl.jpg","Setia Budi, Indonesia"
