"created_at","id_str","full_text","quote_count","reply_count","retweet_count","favorite_count","lang","user_id_str","conversation_id_str","username","tweet_url","image_url","location"
"Fri Jan 26 03:23:22 +0000 2024","1750721060251856993","Di tangan Prabowo-Gibran  keadilan dan kemajuan adalah prioritas utama.   #YukSemuaPilih02 PakBowoMasGib YangTerbaik https://t.co/rlr0WSPvMO","0","0","0","0","in","1724708672553844736","1750721060251856993","sekarameliaaa","https://twitter.com/sekarameliaaa/status/1750721060251856993","https://pbs.twimg.com/ext_tw_video_thumb/1750720991423250432/pu/img/gvq-EuEVEyIbzIna.jpg","Menteng, Indonesia"
"Fri Jan 26 03:23:21 +0000 2024","1750721057282203681","Dukungan yang luas dari masyarakat menunjukkan keyakinan pada integritas dan dedikasi Prabowo-Gibran.   #YukSemuaPilih02 PakBowoMasGib YangTerbaik https://t.co/FqbkJwDEXG","0","0","0","0","in","1651519914321264640","1750721057282203681","GLR_MobilKlasik","https://twitter.com/GLR_MobilKlasik/status/1750721057282203681","https://pbs.twimg.com/media/GEvPgrYaoAAWxl9.jpg","Denpasar Selatan, Indonesia"
"Fri Jan 26 03:23:21 +0000 2024","1750721058683158778","Bersama Prabowo-Gibran  kita jadikan Indonesia emas sebagai kebanggaan bangsa.   #YukSemuaPilih02 PakBowoMasGib YangTerbaik https://t.co/589cnc6jLV","0","0","0","0","in","1701864455225942016","1750721058683158778","pratistaprisila","https://twitter.com/pratistaprisila/status/1750721058683158778","https://pbs.twimg.com/ext_tw_video_thumb/1750721027070672896/pu/img/dXZ4fHgB72pmPXUf.jpg","Bogor Utara 1, Indonesia"
"Fri Jan 26 03:23:23 +0000 2024","1750721067499540963","Brosis  Prabowo-Gibran itu jawaban atas kebutuhan kita yang pengen sejahtera. Kita harus bersatu untuk pilih mereka  gaes!  #YukSemuaPilih02 PakBowoMasGib YangTerbaik https://t.co/R1gVQIQ0rV","0","0","0","0","in","1701794247521996801","1750721067499540963","NashaAlifa","https://twitter.com/NashaAlifa/status/1750721067499540963","https://pbs.twimg.com/media/GEvPhtQacAAFWXb.jpg","Cakung, Indonesia"
"Fri Jan 26 03:23:22 +0000 2024","1750721062135124267","Rakyat semakin bersatu  yakin bahwa Prabowo-Gibran adalah pemimpin yang akan membawa perubahan nyata.   #YukSemuaPilih02 PakBowoMasGib YangTerbaik https://t.co/B7U4q8SNDo","0","0","0","0","in","1701513491407077376","1750721062135124267","winahanifahh","https://twitter.com/winahanifahh/status/1750721062135124267","https://pbs.twimg.com/media/GEvPhScbMAAcAft.jpg","Tangerang, Indonesia"
"Fri Jan 26 03:23:24 +0000 2024","1750721069399576907","Mari satukan suara  Prabowo-Gibran satu pilihan yang melambangkan persatuan dan kesatuan.   #YukSemuaPilih02 PakBowoMasGib YangTerbaik https://t.co/gOc88mNwep","0","0","0","0","in","1706533530489245696","1750721069399576907","cantika_yu","https://twitter.com/cantika_yu/status/1750721069399576907","https://pbs.twimg.com/media/GEvPhqQagAAoGAT.jpg","Pamulang, Indonesia"
"Fri Jan 26 03:23:21 +0000 2024","1750721055075995918","Kebersamaan dalam masyarakat  Prabowo-Gibran adalah solusi untuk kemajuan.   #YukSemuaPilih02 PakBowoMasGib YangTerbaik https://t.co/LO0N18VViq","0","0","0","0","in","1714977702762229760","1750721055075995918","danilsa23049329","https://twitter.com/danilsa23049329/status/1750721055075995918","https://pbs.twimg.com/media/GEvPg2PaMAA62Kz.jpg","Purwokerto Utara, Indonesia"
"Fri Jan 26 03:23:23 +0000 2024","1750721064400023741","Semangat perubahan yang tak terbendung  Prabowo-Gibran adalah kunci ke arah Indonesia emas.   #YukSemuaPilih02 PakBowoMasGib YangTerbaik https://t.co/xbGGMOZ6rk","0","0","0","0","in","1715288315656818688","1750721064400023741","avila_tian61974","https://twitter.com/avila_tian61974/status/1750721064400023741","https://pbs.twimg.com/ext_tw_video_thumb/1750721041079652352/pu/img/MCf3gGbX16MRQgSi.jpg","Setia Budi, Indonesia"
"Fri Jan 26 03:23:21 +0000 2024","1750721056367956296","Prabowo-Gibran  pilihan yang tepat untuk memperkuat sektor pertanian.   #YukSemuaPilih02 PakBowoMasGib YangTerbaik https://t.co/ND0dNzu0xR","0","0","0","0","in","1704765131799117824","1750721056367956296","jaydenpaloo","https://twitter.com/jaydenpaloo/status/1750721056367956296","https://pbs.twimg.com/ext_tw_video_thumb/1750720955973001216/pu/img/JmE6CfbIZJkdK02W.jpg","Banyumas, Indonesia"
"Fri Jan 26 03:23:24 +0000 2024","1750721068938285478","Bersama Prabowo-Gibran  mari kita perjuangkan masa depan yang lebih baik untuk generasi mendatang.   #YukSemuaPilih02 PakBowoMasGib YangTerbaik https://t.co/YPggBLdann","0","0","0","0","in","1732313373541351424","1750721068938285478","RinixvSudiati","https://twitter.com/RinixvSudiati/status/1750721068938285478","https://pbs.twimg.com/media/GEvPiLHbkAE6aLk.jpg","Tapanuli Tengah"
"Fri Jan 26 03:15:30 +0000 2024","1750719081324638454","makin dekat  pemilu jadi semakin terlihat elektabilitasnya .yang mana pasangan @prabowo &amp; @gibran_tweet ini sangat lebih ungguh sebanyak 47% dibanding dgn paslon lainnya keren emang . #JatengGasPolll https://t.co/VUPVJhKLZc","0","0","0","0","in","1705069673430306816","1750719081324638454","xbdjdbddjdndj","https://twitter.com/xbdjdbddjdndj/status/1750719081324638454","https://pbs.twimg.com/media/GEvNuFFaIAAAa3F.jpg",""
"Fri Jan 26 03:20:08 +0000 2024","1750720248536506393","Gibran terlihat seperti boneka yang hanya bisa melakukan gimmick tanpa memiliki landasan intelektual yang kuat @dy_emerald https://t.co/Tb8u0kONSP","0","0","0","0","in","1676095678228107264","1750720248536506393","MuhEddie","https://twitter.com/MuhEddie/status/1750720248536506393","https://pbs.twimg.com/ext_tw_video_thumb/1750720213040205824/pu/img/hbM839z8ONcrCOh_.jpg","Surabaya"
"Fri Jan 26 03:23:42 +0000 2024","1750721145782059301","Kepercayaan masyarakat pada Prabowo-Gibran adalah hasil dari penilaian cermat akan kualitas kepemimpinan dan integritas keduanya.   #YukSemuaPilih02 PakBowoMasGib YangTerbaik https://t.co/bcxBjQcK6j","0","0","0","0","in","1706604443645677568","1750721145782059301","DivaKejora","https://twitter.com/DivaKejora/status/1750721145782059301","https://pbs.twimg.com/ext_tw_video_thumb/1750721016287141888/pu/img/qIVu6KWQXIPR4-Rl.jpg","Lamongan, Indonesia"
"Fri Jan 26 03:23:41 +0000 2024","1750721139268370884","Prabowo-Gibran  pemimpin yang berkomitmen untuk kemajuan bangsa.   #YukSemuaPilih02 PakBowoMasGib YangTerbaik https://t.co/qaweDj6JOP","0","0","0","0","in","1738172526805843969","1750721139268370884","EkaudMarpaung","https://twitter.com/EkaudMarpaung/status/1750721139268370884","https://pbs.twimg.com/ext_tw_video_thumb/1750721072104960000/pu/img/_q_HCBbfsdhgyN8k.jpg","Cilacap"
"Fri Jan 26 03:23:41 +0000 2024","1750721142539923796","Semangat perubahan membara  masyarakat yakin Prabowo-Gibran akan membawa Indonesia ke era keemasan yang baru.   #YukSemuaPilih02 PakBowoMasGib YangTerbaik https://t.co/etPmVnbguX","0","0","0","0","in","1702168099506757632","1750721142539923796","TKalahari__0","https://twitter.com/TKalahari__0/status/1750721142539923796","https://pbs.twimg.com/ext_tw_video_thumb/1750721117395042304/pu/img/rlRB_PQw9xCW2Xhy.jpg","Matraman, Indonesia"
"Fri Jan 26 03:23:42 +0000 2024","1750721145979220269","Prabowo-Gibran  pemimpin yang memperjuangkan hak minoritas.   #YukSemuaPilih02 PakBowoMasGib YangTerbaik https://t.co/9LQgfBJtpy","0","0","0","0","in","1698622734752944128","1750721145979220269","riski_antorio","https://twitter.com/riski_antorio/status/1750721145979220269","https://pbs.twimg.com/media/GEvPmKqawAALuzx.jpg","Banyumas, Indonesia"
"Fri Jan 26 03:23:40 +0000 2024","1750721137020117335","Bersama Prabowo-Gibran  kita bisa menciptakan perubahan positif. Mari perkuat dukungan kita!   #YukSemuaPilih02 PakBowoMasGib YangTerbaik https://t.co/3MO6PtAEOo","0","0","0","0","in","1724702976441556992","1750721137020117335","rikisetiawan_n","https://twitter.com/rikisetiawan_n/status/1750721137020117335","https://pbs.twimg.com/ext_tw_video_thumb/1750720944149340160/pu/img/kRPCRFg153sH8nga.jpg","Brebes, Indonesia"
"Fri Jan 26 03:23:39 +0000 2024","1750721132733546859","Gimmick adalah satu-satunya bahasa yang dikuasai oleh Gibran  sementara gagasan dan visinya tidak tampak @ebeciku https://t.co/ORTOq9aNkv","0","0","0","0","in","1677141245381197825","1750721132733546859","RizkyUtumo","https://twitter.com/RizkyUtumo/status/1750721132733546859","https://pbs.twimg.com/ext_tw_video_thumb/1750721092619255808/pu/img/JyvsvBBnBaq9HT0K.jpg","Metro"
"Fri Jan 26 03:23:40 +0000 2024","1750721137028616615","Dalam Prabowo-Gibran  kita temukan kekuatan untuk membangun negeri ini bersama-sama!   #YukSemuaPilih02 PakBowoMasGib YangTerbaik https://t.co/jApbr9RKT6","0","0","0","0","in","1701861686716874752","1750721137028616615","Noyaa_slfn","https://twitter.com/Noyaa_slfn/status/1750721137028616615","https://pbs.twimg.com/media/GEvPmMEbQAA0p79.jpg","Cilandak, Indonesia"
"Fri Jan 26 03:23:40 +0000 2024","1750721135652872477","Solidaritas sejati terpancar dalam dukungan untuk Prabowo-Gibran sebagai jalan menuju Indonesia yang berjaya.   #YukSemuaPilih02 PakBowoMasGib YangTerbaik https://t.co/LHGrlI3uQL","0","0","0","0","in","1704741700978290688","1750721135652872477","DikaHardiansya","https://twitter.com/DikaHardiansya/status/1750721135652872477","https://pbs.twimg.com/ext_tw_video_thumb/1750721056825085952/pu/img/ehsjKfdPsdVc5y6W.jpg","Batang, Indonesia"
"Fri Jan 26 03:23:38 +0000 2024","1750721130485501956","Bersama-sama  kita wujudkan perubahan positif dengan mendukung Prabowo-Gibran.   #YukSemuaPilih02 PakBowoMasGib YangTerbaik https://t.co/OthgVQnvrF","0","0","0","0","in","1701094286216110080","1750721130485501956","bintangdau","https://twitter.com/bintangdau/status/1750721130485501956","https://pbs.twimg.com/ext_tw_video_thumb/1750720965586362368/pu/img/ZSeyvVnWE1hbWleX.jpg","Kota Yogyakarta, Yogyakarta"
"Fri Jan 26 03:23:37 +0000 2024","1750721123762028613","Bersama Prabowo-Gibran  mari kita wujudkan impian Indonesia yang lebih baik!   #YukSemuaPilih02 PakBowoMasGib YangTerbaik https://t.co/x2OpkhJbly","0","0","0","0","in","1701133487959584768","1750721123762028613","BadangFauzi","https://twitter.com/BadangFauzi/status/1750721123762028613","https://pbs.twimg.com/ext_tw_video_thumb/1750721021026635777/pu/img/14R6yyCdnMOFlSN6.jpg","Serang, Indonesia"
"Fri Jan 26 03:23:40 +0000 2024","1750721135858319811","Bersama Prabowo-Gibran  kita bisa menciptakan masa depan yang lebih adil dan sejahtera.   #YukSemuaPilih02 PakBowoMasGib YangTerbaik https://t.co/eVZd5nKIYU","0","0","0","0","in","1740849581691379712","1750721135858319811","DimasnePrastuti","https://twitter.com/DimasnePrastuti/status/1750721135858319811","https://pbs.twimg.com/ext_tw_video_thumb/1750721035748708353/pu/img/N7Up-8TVbh5BWsBE.jpg","Kaur Selatan, Indonesia"
"Fri Jan 26 03:23:37 +0000 2024","1750721123929714891","Prabowo-Gibran  pemimpin yang mencerminkan persatuan dalam perbedaan.   #YukSemuaPilih02 PakBowoMasGib YangTerbaik https://t.co/oZJ5WinpLo","0","0","0","0","in","1720359305684320256","1750721123929714891","AslijanJan83564","https://twitter.com/AslijanJan83564/status/1750721123929714891","https://pbs.twimg.com/media/GEvPk4VbAAA7LfK.jpg","Banyumas, Indonesia"
"Fri Jan 26 03:23:29 +0000 2024","1750721090677305488","Pilihan masyarakat untuk Prabowo-Gibran mencerminkan aspirasi bersama untuk memiliki pemimpin yang berkomitmen pada kepentingan rakyat dan pembangunan yang berkelanjutan.   #YukSemuaPilih02 PakBowoMasGib YangTerbaik https://t.co/BF0bbNXang","0","0","0","0","in","1717810402695020544","1750721090677305488","dindaputtrii_","https://twitter.com/dindaputtrii_/status/1750721090677305488","https://pbs.twimg.com/ext_tw_video_thumb/1750721050479063040/pu/img/o6F4RM23RCKTlJwi.jpg","Kota Surabaya, Jawa Timur"
"Fri Jan 26 03:23:38 +0000 2024","1750721129831153973","Bersama Prabowo-Gibran  kita berjuang untuk menciptakan masa depan Indonesia yang cemerlang.   #YukSemuaPilih02 PakBowoMasGib YangTerbaik https://t.co/riGrEvnhcK","0","0","0","0","in","1705067666233499648","1750721129831153973","RendaHilmawan","https://twitter.com/RendaHilmawan/status/1750721129831153973","https://pbs.twimg.com/media/GEvPlL1b0AA2F5x.jpg","Bogor Selatan, Indonesia"
"Fri Jan 26 03:23:36 +0000 2024","1750721121123807538","Solidaritas masyarakat adalah fondasi kuat dalam meraih visi Indonesia emas bersama Prabowo-Gibran.   #YukSemuaPilih02 PakBowoMasGib YangTerbaik https://t.co/ZDUqzqUu1W","0","0","0","0","in","1697855766655606784","1750721121123807538","mhyudaniel3","https://twitter.com/mhyudaniel3/status/1750721121123807538","https://pbs.twimg.com/ext_tw_video_thumb/1750721097618903040/pu/img/6y5_F6lvDF1Ifv5D.jpg","Jatiasih, Indonesia"
"Fri Jan 26 03:23:36 +0000 2024","1750721117961191906","Solidaritas rakyat terwujud dalam dukungan untuk Prabowo-Gibran.   #YukSemuaPilih02 PakBowoMasGib YangTerbaik https://t.co/2e4miY3D01","0","0","0","0","in","1714944062569295872","1750721117961191906","brahmangustio","https://twitter.com/brahmangustio/status/1750721117961191906","https://pbs.twimg.com/media/GEvPkbtacAALXUW.jpg","Pati, Indonesia"
"Fri Jan 26 03:23:37 +0000 2024","1750721124026175559","Prabowo-Gibran adalah pasangan yang siap menghadapi segala tantangan demi kebaikan rakyat.   #YukSemuaPilih02 PakBowoMasGib YangTerbaik https://t.co/H0HBvoEpcP","0","0","0","0","in","1728203783044534272","1750721124026175559","magical_restora","https://twitter.com/magical_restora/status/1750721124026175559","https://pbs.twimg.com/ext_tw_video_thumb/1750720986624958465/pu/img/FlyCbM4dFP0qn0pS.jpg","Lhokseumawe"
"Fri Jan 26 03:23:28 +0000 2024","1750721086382285177","Solidaritas masyarakat menjadi kekuatan  semua bersatu mendukung Prabowo-Gibran.   #YukSemuaPilih02 PakBowoMasGib YangTerbaik https://t.co/py4w0OlPVX","0","0","0","0","in","1702243219395039232","1750721086382285177","layla0r6il","https://twitter.com/layla0r6il/status/1750721086382285177","https://pbs.twimg.com/media/GEvPjESbAAA30vI.jpg","Malang, Jawa Timur"
"Fri Jan 26 03:23:36 +0000 2024","1750721120670806086","Bersama Prabowo-Gibran  kita bergerak maju untuk mewujudkan Indonesia emas yang gemilang.   #YukSemuaPilih02 PakBowoMasGib YangTerbaik https://t.co/EtjlGkoJeS","0","0","0","0","in","1704379333677346816","1750721120670806086","tuti7dwi","https://twitter.com/tuti7dwi/status/1750721120670806086","https://pbs.twimg.com/ext_tw_video_thumb/1750721091117752320/pu/img/1MPWfr_Qv9KRHsb0.jpg","Malang, Jawa Timur"
"Fri Jan 26 03:23:37 +0000 2024","1750721124797911126","Pilih Prabowo-Gibran  pilihan yang tepat untuk masa depan yang lebih baik.   #YukSemuaPilih02 PakBowoMasGib YangTerbaik https://t.co/tCX0eqlDI4","0","0","0","0","in","1701815882224447488","1750721124797911126","FatharaniKrn_","https://twitter.com/FatharaniKrn_/status/1750721124797911126","https://pbs.twimg.com/media/GEvPkleaAAA1n-e.jpg","Jakarta Capital Region, Indone"
"Fri Jan 26 03:24:00 +0000 2024","1750721221606699010","Dukungan untuk Prabowo-Gibran semakin membara  menunjukkan keinginan rakyat untuk perubahan.   #YukSemuaPilih02 PakBowoMasGib YangTerbaik https://t.co/zQkEJHFXOw","0","0","0","0","in","1715340273419726848","1750721221606699010","gino_anton77926","https://twitter.com/gino_anton77926/status/1750721221606699010","https://pbs.twimg.com/ext_tw_video_thumb/1750721148189552640/pu/img/VF6zmnQ2_CqE6d1A.jpg","Purwodadi, Indonesia"
"Fri Jan 26 03:23:59 +0000 2024","1750721218398081457","Dukungan yang tulus  Prabowo-Gibran adalah pilihan yang tepat.   #YukSemuaPilih02 PakBowoMasGib YangTerbaik https://t.co/XL3Pm6Z0P9","0","0","0","0","in","1701160149287927809","1750721218398081457","kantipmawan","https://twitter.com/kantipmawan/status/1750721218398081457","https://pbs.twimg.com/ext_tw_video_thumb/1750721146260217856/pu/img/m3UUG2K5lxL0ASpI.jpg","Jombang, Indonesia"
"Fri Jan 26 03:23:59 +0000 2024","1750721214430232812","Prabowo-Gibran  pilihan cerdas untuk masa depan yang lebih baik.   #YukSemuaPilih02 PakBowoMasGib YangTerbaik https://t.co/8zHecYRsKl","0","0","0","0","in","1716363938512920576","1750721214430232812","hanna18987","https://twitter.com/hanna18987/status/1750721214430232812","https://pbs.twimg.com/ext_tw_video_thumb/1750721006845743104/pu/img/4QM7DdRJQGKlRpY9.jpg","Purwokerto Timur, Indonesia"
"Fri Jan 26 03:23:59 +0000 2024","1750721216061780203","Optimisme membara  perubahan bersama Prabowo-Gibran semakin nyata.   #YukSemuaPilih02 PakBowoMasGib YangTerbaik https://t.co/VxPowfDhiE","0","0","0","0","in","1714876363214389248","1750721216061780203","AizaLaina","https://twitter.com/AizaLaina/status/1750721216061780203","https://pbs.twimg.com/ext_tw_video_thumb/1750721108616286208/pu/img/IOssc9WqP8o4CMSG.jpg","Setia Budi, Indonesia"
"Fri Jan 26 03:24:00 +0000 2024","1750721219161391167","Semua kalangan bersatu  mengukir sejarah kemenangan untuk Prabowo-Gibran.   #YukSemuaPilih02 PakBowoMasGib YangTerbaik https://t.co/O8bkC5lOgO","0","0","0","0","in","1719309915611951104","1750721219161391167","MirraNaila27918","https://twitter.com/MirraNaila27918/status/1750721219161391167","https://pbs.twimg.com/media/GEvPqR_bAAAnwlm.jpg","Bandung, Jawa Barat"
"Fri Jan 26 03:23:56 +0000 2024","1750721202887459039","Bersama Prabowo-Gibran  kita bisa membangun Indonesia yang lebih baik!   #YukSemuaPilih02 PakBowoMasGib YangTerbaik https://t.co/HpS7IcvsI7","0","0","0","0","in","1718933656260186112","1750721202887459039","RandiMarhaban","https://twitter.com/RandiMarhaban/status/1750721202887459039","https://pbs.twimg.com/media/GEvPpOAbcAAxlid.jpg","Wanokuni"
"Fri Jan 26 03:23:56 +0000 2024","1750721204162638165","Dukungan rakyat  modal penting bagi Prabowo-Gibran untuk membangun negara.   #YukSemuaPilih02 PakBowoMasGib YangTerbaik https://t.co/EHpZyg347G","0","0","0","0","in","1655415538586382337","1750721204162638165","tania_yumn29408","https://twitter.com/tania_yumn29408/status/1750721204162638165","https://pbs.twimg.com/ext_tw_video_thumb/1750720962474242048/pu/img/j8o2rgLehxpnkmeL.jpg","Banyumas, Indonesia"
"Fri Jan 26 03:23:57 +0000 2024","1750721208646271173","Prabowo-Gibran  pasangan yang dianggap memiliki kemampuan dan dedikasi untuk memimpin Indonesia menuju masa depan yang lebih cerah.   #YukSemuaPilih02 PakBowoMasGib YangTerbaik https://t.co/DopZ9vLxtf","0","0","0","0","in","1702538765032669184","1750721208646271173","kin_tamara","https://twitter.com/kin_tamara/status/1750721208646271173","https://pbs.twimg.com/ext_tw_video_thumb/1750721167428825088/pu/img/MgMMzvBIGgi0PBN1.jpg","Indonesia"
"Fri Jan 26 03:23:57 +0000 2024","1750721208298152082","Bersama Prabowo-Gibran  kita perangi korupsi dan kolusi.   #YukSemuaPilih02 PakBowoMasGib YangTerbaik https://t.co/wpKI2wg5ES","0","0","0","0","in","1706537542760448000","1750721208298152082","delishaayla5","https://twitter.com/delishaayla5/status/1750721208298152082","https://pbs.twimg.com/ext_tw_video_thumb/1750721130049249280/pu/img/q7lUxVULumEPA88Q.jpg","Salatiga, Jawa Tengah"
"Fri Jan 26 03:23:57 +0000 2024","1750721208277221477","Prabowo-Gibran  pemimpin yang akan membawa Indonesia ke arah kemajuan dan kejayaan!   #YukSemuaPilih02 PakBowoMasGib YangTerbaik https://t.co/d7efKlGQex","0","0","0","0","in","1702555931769470976","1750721208277221477","wrdn_yashh","https://twitter.com/wrdn_yashh/status/1750721208277221477","https://pbs.twimg.com/media/GEvPqRhbIAANGyv.jpg","Semarang, Jawa Tengah"
"Fri Jan 26 03:23:55 +0000 2024","1750721201255960782","Prabowo-Gibran adalah pemimpin yang berkomitmen untuk memajukan teknologi demi kesejahteraan kita semua.   #YukSemuaPilih02 PakBowoMasGib YangTerbaik https://t.co/GmqCsmGg2G","0","0","0","0","in","1701783510242197504","1750721201255960782","aneishaaurelia","https://twitter.com/aneishaaurelia/status/1750721201255960782","https://pbs.twimg.com/media/GEvPpWUb0AA_plI.jpg","Purwodadi, Indonesia"
"Fri Jan 26 03:23:58 +0000 2024","1750721211708178834","Bersama Prabowo-Gibran  kita akan saksikan Indonesia berkembang pesat.   #YukSemuaPilih02 PakBowoMasGib YangTerbaik https://t.co/19DAb32X14","0","0","0","0","in","1728178051312414720","1750721211708178834","restrained_tele","https://twitter.com/restrained_tele/status/1750721211708178834","https://pbs.twimg.com/media/GEvPqGKbkAAC0S4.jpg","Wonogiri, Indonesia"
"Fri Jan 26 03:23:57 +0000 2024","1750721207677378870","Satukan langkah  satukan hati  dukung Prabowo-Gibran memimpin Indonesia.   #YukSemuaPilih02 PakBowoMasGib YangTerbaik https://t.co/6VAFiQIOK9","0","0","0","0","in","1701844194233626624","1750721207677378870","isnatri57","https://twitter.com/isnatri57/status/1750721207677378870","https://pbs.twimg.com/media/GEvPpY4bUAAMJHD.jpg","Cimanggis, Indonesia"
"Thu Jan 25 08:50:05 +0000 2024","1750440894720053638","Nusron Wahid mengajak semua masyarakat untuk mendukung prabowo gibran dan memenangkannya dalam sekali putaran #Dapil2JatengAllin02 https://t.co/096VoqsIx0","33","29","31","42","in","1695089161651568640","1750440894720053638","mahenczf","https://twitter.com/mahenczf/status/1750440894720053638","https://pbs.twimg.com/media/GErQteObYAAjl9m.jpg","Jakarta Selatan, DKI Jakarta"
"Thu Jan 25 12:09:00 +0000 2024","1750490951720808528","Keikutsertaan Mas Gibran dalam acara sholawatan menjadi wujud nyata dari keterlibatannya dalam kehidupan keagamaan masyarakat  Gibran Berani #SaatnyaPindahKe02 #MauGabung02Silakan https://t.co/z1LN4weA66","37","81","27","128","in","2957636371","1750490951720808528","RI_XXIV","https://twitter.com/RI_XXIV/status/1750490951720808528","https://pbs.twimg.com/ext_tw_video_thumb/1750490776495419392/pu/img/jTilb3sliQaTFnNZ.jpg","Jakarta Indonesia "
"Fri Jan 26 03:24:05 +0000 2024","1750721239684165916","Prabowo-Gibran  pemimpin yang mewakili suara rakyat.   #YukSemuaPilih02 PakBowoMasGib YangTerbaik https://t.co/fTmD6a1QIR","0","0","0","0","in","1697814466262634496","1750721239684165916","AbizarSetya","https://twitter.com/AbizarSetya/status/1750721239684165916","https://pbs.twimg.com/ext_tw_video_thumb/1750721117755699200/pu/img/m_SD9YMrv5NeP9Mv.jpg","Banyumas, Indonesia"
"Fri Jan 26 03:24:06 +0000 2024","1750721246436999487","Solidaritas masyarakat adalah kunci sukses dalam mencapai visi Indonesia emas bersama Prabowo-Gibran.   #YukSemuaPilih02 PakBowoMasGib YangTerbaik https://t.co/Xro3QjwteG","0","0","0","0","in","1715293456325906432","1750721246436999487","intantasya58088","https://twitter.com/intantasya58088/status/1750721246436999487","https://pbs.twimg.com/ext_tw_video_thumb/1750721165197500416/pu/img/4fh8iUVRFxb-CKUX.jpg","Mojosari"
"Fri Jan 26 03:24:05 +0000 2024","1750721240820752558","Pada akhirnya  Gibran hanyalah bayangan dari apa yang seharusnya menjadi sosok cawapres yang berpikiran tajam  terkubur di bawah tumpukan gimmick @dibmi_na https://t.co/7A92Dk0q5K","0","0","0","0","in","1679044474478145536","1750721240820752558","MaryaniEui2","https://twitter.com/MaryaniEui2/status/1750721240820752558","https://pbs.twimg.com/ext_tw_video_thumb/1750721210751889408/pu/img/TTDJuf7CxLO-Na8h.jpg",""
"Fri Jan 26 03:24:07 +0000 2024","1750721248689258756","Solidaritas masyarakat terwujud  dukungan untuk Prabowo-Gibran tak tergoyahkan.   #YukSemuaPilih02 PakBowoMasGib YangTerbaik https://t.co/stTlf7xWCo","0","0","0","0","in","1715307673607159808","1750721248689258756","viraandini432","https://twitter.com/viraandini432/status/1750721248689258756","https://pbs.twimg.com/media/GEvPr8xaAAAg652.jpg","Jakarta Utara, DKI Jakarta"
"Fri Jan 26 03:24:06 +0000 2024","1750721245778464853","Prabowo-Gibran  pemimpin yang berkomitmen untuk melindungi lingkungan.   #YukSemuaPilih02 PakBowoMasGib YangTerbaik https://t.co/zE28vKdzrs","0","0","0","0","in","1649348763348238339","1750721245778464853","FakhriAriz42595","https://twitter.com/FakhriAriz42595/status/1750721245778464853","https://pbs.twimg.com/ext_tw_video_thumb/1750720981763821569/pu/img/zOJHj_-Rq3m1UHTH.jpg","Baturaden, Indonesia"
"Fri Jan 26 03:24:04 +0000 2024","1750721235666051482","Momentum penting untuk memperkuat dukungan kita kepada Prabowo-Gibran  pemimpin yang siap membawa perubahan positif.   #YukSemuaPilih02 PakBowoMasGib YangTerbaik https://t.co/QRbf3UyB2K","0","0","0","0","in","1719326562263388160","1750721235666051482","putrinugra60567","https://twitter.com/putrinugra60567/status/1750721235666051482","https://pbs.twimg.com/media/GEvPrksa8AAc2p4.jpg","Serang, Indonesia"
"Fri Jan 26 03:24:01 +0000 2024","1750721225322799355","Prabowo-Gibran adalah pemimpin yang memiliki komitmen kuat untuk memperjuangkan kepentingan rakyat Indonesia.   #YukSemuaPilih02 PakBowoMasGib YangTerbaik https://t.co/9D6UHb2kGt","0","0","0","0","in","1701537154571321344","1750721225322799355","its_andirianto","https://twitter.com/its_andirianto/status/1750721225322799355","https://pbs.twimg.com/ext_tw_video_thumb/1750721208109441024/pu/img/2JT1-A82yJgrtENY.jpg","Brebes, Indonesia"
"Fri Jan 26 03:24:03 +0000 2024","1750721232834851126","Dukungan kita pada Prabowo - Gibran adalah dukungan untuk kemajuan bangsa.   #YukSemuaPilih02 PakBowoMasGib YangTerbaik https://t.co/qNig5EeLZR","0","0","0","0","in","1701417380013092864","1750721232834851126","HanakaHans","https://twitter.com/HanakaHans/status/1750721232834851126","https://pbs.twimg.com/media/GEvPrVKbIAAirN3.jpg","Semarang, Jawa Tengah"
"Fri Jan 26 03:24:05 +0000 2024","1750721243089899809","Prabowo-Gibran  pemimpin yang mampu mengembangkan potensi negara.   #YukSemuaPilih02 PakBowoMasGib YangTerbaik https://t.co/Yjo5N66gJE","0","0","0","0","in","1652156062202753025","1750721243089899809","bimagustian_","https://twitter.com/bimagustian_/status/1750721243089899809","https://pbs.twimg.com/media/GEvPrnfbkAAucJ4.jpg","Cipondoh, Indonesia"
"Fri Jan 26 03:24:01 +0000 2024","1750721224014229707","Dukungan untuk Prabowo-Gibran semakin kuat  rakyat Indonesia yakin pada visi mereka.   #YukSemuaPilih02 PakBowoMasGib YangTerbaik https://t.co/S9J6IRN9RD","0","0","0","0","in","1714904462899527680","1750721224014229707","damayantii65522","https://twitter.com/damayantii65522/status/1750721224014229707","https://pbs.twimg.com/media/GEvPqvnbIAA_8LZ.jpg","Magetan, Indonesia"
