"created_at","id_str","full_text","quote_count","reply_count","retweet_count","favorite_count","lang","user_id_str","conversation_id_str","username","tweet_url","image_url","location"
"Thu Jan 25 06:03:59 +0000 2024","1750399094944842154","Dalam rangka mendukung Prabowo-Gibran  INKUD Jawa Tengah menggelar acara konsolidasi dan memberikan bantuan alat genset kepada masyarakat di Jawa Tengah sebagai bentuk dukungan. #PrabowoMenangKoperasiJaya https://t.co/Rd0y0mAyLC","0","0","9","6","in","1413689671821893641","1750399094944842154","Septyamaliaa","https://twitter.com/Septyamaliaa/status/1750399094944842154","https://pbs.twimg.com/media/GEqqsmpa4AA_DIC.jpg",""
"Thu Jan 25 06:05:09 +0000 2024","1750399386067378530","Dalam upaya mendukung Prabowo-Gibran  INKUD Jawa Tengah mengadakan acara konsolidasi dan memberikan bantuan alat genset kepada masyarakat di Jawa Tengah. #PrabowoMenangKoperasiJaya https://t.co/ctToP6mhNY","0","0","9","6","in","1413689671821893641","1750399386067378530","Septyamaliaa","https://twitter.com/Septyamaliaa/status/1750399386067378530","https://pbs.twimg.com/media/GEqq9bLaEAAUU3y.jpg",""
"Thu Jan 25 06:21:24 +0000 2024","1750403476696584677","Kalau terjadi satu putaran dan pemenangnya bukan Prabowo-Gibran  keknya asyik ya... Hemat uang negara  hemat uang Prabowo  ambisi culas dinasti pun buyar. Tingkah barbar dan arogansi kekuasaan bisa dihentikan.   Rakyat kemungkinan besar akan lebih senang dgn kondisi di atas.","29","129","636","2403","in","907897495044317185","1750403476696584677","UyokBack","https://twitter.com/UyokBack/status/1750403476696584677","",""
"Thu Jan 25 06:44:59 +0000 2024","1750409410839711893","Inkud membagikan bantuan genset di jawa tengah karena dukung prabowo gibran #PrabowoMenangKoperasiJaya https://t.co/eGmSFbXCX4","0","0","6","4","in","1320675543864332288","1750409410839711893","jkunmyeon","https://twitter.com/jkunmyeon/status/1750409410839711893","https://pbs.twimg.com/media/GEq0Eyua0AAyKj2.jpg","she / her"
"Thu Jan 25 05:53:51 +0000 2024","1750396542463430890","Masyarakat semakin yakin bahwa Prabowo-Gibran adalah pasangan yang tepat untuk melanjutkan estafet kepemimpinan pak Jokowi. Dukungan mereka terus bertambah dari berbagai kalangan  termasuk dari komunitas koperasi. #PrabowoMenangKoperasiJaya https://t.co/hvNJD7Y6VF","0","0","9","6","in","1720514749979619328","1750396542463430890","friskasanti_","https://twitter.com/friskasanti_/status/1750396542463430890","https://pbs.twimg.com/media/GEqoYBrbIAAUHUW.jpg",""
"Thu Jan 25 06:27:56 +0000 2024","1750405120578437161","Ratusan emak-emak dan buruh tani serta nelayan di Situbondo mendeklarasikan dukungan untuk pasangan calon presiden dan wakil presiden nomor urut 02 Prabowo Subianto-Gibran Rakabuming Raka. #PrabowoMenangKoperasiJaya https://t.co/KYqNAjA6Iv","0","0","6","5","in","1316906354401931265","1750405120578437161","SE0K0","https://twitter.com/SE0K0/status/1750405120578437161","https://pbs.twimg.com/media/GEqwLkYaEAAICHA.jpg","s/her."
"Thu Jan 25 06:49:37 +0000 2024","1750410578592764084","Faktanya  Jokowi mainnya kasar sekali di pilpres kali ini. Gibran dipaksakan maju  gelagat tidak netralnya aparat  dan masih banyak lagi. Ya nggak perlu dipungkiri.  Namun dalam hati kadang masih sulit untuk tidak percaya ke Jokowi.  Mungkin itu yang dirasakan bro dan sis PSI … https://t.co/b53LBKwj5t","6","68","31","105","in","185156524","1750410578592764084","hasyimmah","https://twitter.com/hasyimmah/status/1750410578592764084","https://pbs.twimg.com/amplify_video_thumb/1750410221166710784/img/qsWev-KE__W98Hk6.jpg","Mojokerto"
"Thu Jan 25 05:52:38 +0000 2024","1750396238594449775","Dukungan kepada Prabowo-Gibran semakin meluas dari berbagai kalangan masyarakat  menunjukkan keyakinan mereka terhadap kepemimpinan mereka untuk melanjutkan estafet kepemimpinan pak Jokowi. #PrabowoMenangKoperasiJaya https://t.co/0at2M0WlMc","0","0","9","7","in","1720514749979619328","1750396238594449775","friskasanti_","https://twitter.com/friskasanti_/status/1750396238594449775","https://pbs.twimg.com/media/GEqoGWebMAARdCv.jpg",""
"Thu Jan 25 07:48:17 +0000 2024","1750425342261821559","Koperasi Unit Desa (KUD) Se-Jateng siap menangkan pasangan Prabowo-Gibran. #PrabowoMenangKoperasiJaya https://t.co/QoqyyXYtE8","0","0","2","3","in","2306717563","1750425342261821559","jessiellence","https://twitter.com/jessiellence/status/1750425342261821559","https://pbs.twimg.com/media/GErCkpWasAA1iP6.jpg","DKI Jakarta, Indonesia"
"Thu Jan 25 06:19:18 +0000 2024","1750402947450872119","Indonesia pasti akan menjadi emas tahun 2045 di tangan Prabowo-Gibran  karena mereka akan melakukan banyak perubahan dan melaksanakan visi dan misi yang mereka punya untuk mewujudkan kekuatan masyarakat agar dapat menggapai Indonesia emas di tahun 2045. #PrabowoMenangKoperasiJaya https://t.co/BQVeh2TCJ5","0","0","6","4","in","1412184751","1750402947450872119","DEWIKECEB0NG","https://twitter.com/DEWIKECEB0NG/status/1750402947450872119","https://pbs.twimg.com/media/GEquNGFaMAAtauW.jpg","loving opuy endlessly 🫶🏻"
"Thu Jan 25 06:42:16 +0000 2024","1750408729886150920","Ratusan Emak2  Buruh Tani &amp; Nelayan situbondo dukung Prabowo - Gibran. Mantap ini lurr 👍 #PrabowoMenangKoperasiJaya https://t.co/86cMTcRCrC","0","0","9","7","in","255928541","1750408729886150920","eribgo","https://twitter.com/eribgo/status/1750408729886150920","https://pbs.twimg.com/media/GEqzdq6aEAAp2mv.jpg",""
"Thu Jan 25 06:01:16 +0000 2024","1750398409079726276","Yg terlintas dibenak pak Anies saat mendorong becak adalah filosofi mengangkat dan mendorong yg kecil maju ke depan.  Sementara yg terlintas di benakku: Prabowo sulit utk melakukan hal yg sama (mendorong becak). Krn mendorong Gibran maju aja udah berat! 🤣 https://t.co/yeTmPnnvFK","1","10","23","59","in","1544189100147613696","1750398409079726276","cute_julianna","https://twitter.com/cute_julianna/status/1750398409079726276","https://pbs.twimg.com/ext_tw_video_thumb/1750173487317262336/pu/img/70UEvGqv-QZDN7BS.jpg",""
"Thu Jan 25 06:41:33 +0000 2024","1750408545923952967","Mantap makin banyak rapatan barisan untuk prabowo gibran #PrabowoMenangKoperasiJaya https://t.co/apH9oUri2c","0","0","10","7","in","1547451484237078528","1750408545923952967","axelarchieve","https://twitter.com/axelarchieve/status/1750408545923952967","https://pbs.twimg.com/media/GEqzSuRa0AArOL5.jpg",""
"Thu Jan 25 06:16:41 +0000 2024","1750402290673205418","Emak emak buruh tani di Situbondo saja sudah mendukung Prabowo-Gibran dan mereka yakin bahwa visi misi 02 sangat berguna untuk Indonesia. Mari kita rapatkan barisan kita untuk memenangkan Prabowo-Gibran dalam satu putaran di pilpres 2024. #PrabowoMenangKoperasiJaya https://t.co/7mMuHBT6hV","0","0","5","3","in","1412184751","1750402290673205418","DEWIKECEB0NG","https://twitter.com/DEWIKECEB0NG/status/1750402290673205418","https://pbs.twimg.com/media/GEqtm0iagAAA2tY.jpg","loving opuy endlessly 🫶🏻"
"Thu Jan 25 01:20:02 +0000 2024","1750327637011255419","wkwkwkkwk ini gibran sendiri yg ngasih pertanyaan  gibran sendiri yg bawa-bawa tom lembong  tapi satu kabinet yg nyuci piring wkwkwkwkw komedi","204","158","5257","22780","in","285031352","1750327637011255419","Faiz_akbar14","https://twitter.com/Faiz_akbar14/status/1750327637011255419","",""
"Wed Jan 24 15:17:17 +0000 2024","1750175949927403941","Kalian pikir Jokowi itu dukung prabowo? Engga anjir. Dia itu cuma dukung anaknya. Nnt kalo terpilih  prabowo dicampak ke IKN trus si gibran jd penguasa jabodetabek","1198","805","9959","47307","in","318405502","1750175949927403941","ellinoyaa","https://twitter.com/ellinoyaa/status/1750175949927403941","","Kota Medan, Sumatera Utara"
"Thu Jan 25 02:02:19 +0000 2024","1750338277880869332","Boy Thohir  Erik Thohir  Luhut  dan Pandu  serta Arini (merujuk pernyataan Boy) sama-sama mendukung Prabowo-Gibran.   Sementara Sandiaga ada di kubu Ganjar-Mahfud.   Tapi  apa yang mempertemukan mereka?   #PemiluMemilukan https://t.co/MVMPTtL4i3","137","370","1884","5293","in","890819108","1750338277880869332","melky_nahar","https://twitter.com/melky_nahar/status/1750338277880869332","https://pbs.twimg.com/media/GEpzYaDbcAA3FpP.jpg",""
"Wed Jan 24 18:24:10 +0000 2024","1750222980523942010","Kalau masuknya gibran aja udah berefek kenaikan elektabilitas 45%  tapi knapa masih harus juga dibantu sama presiden  menteri  istana  influencer  ustad  sembako  kepala desa  aparat kepolisian  akun kemenhan  zarry  buzzer. Sebenernya ada apasi? Apa yang disembunyikan?🤔🤔🤔🤔","185","276","4149","22772","in","1517123019453636609","1750222980523942010","legislatweet","https://twitter.com/legislatweet/status/1750222980523942010","",""
"Wed Jan 24 08:52:00 +0000 2024","1750078988528349386","Duh malu gak tuh sih Samsul  Melihat Sejumlah media asing menyoroti pernyataan hingga gimik kasarnya?  Pak @jokowi nih Media Singapura  Channel NewsAsia (CNA)  menuliskan sikap mas Gibran yang “songong” tolong di bungkam 😂 #AsalBukanPrabowoGibran https://t.co/O9wpe0VdTE","71","251","881","3007","in","1374686160748830724","1750078988528349386","DS_yantie","https://twitter.com/DS_yantie/status/1750078988528349386","https://pbs.twimg.com/media/GEmHkKFawAAwEZg.jpg",""
"Thu Jan 25 00:16:44 +0000 2024","1750311703806714071","Lg di airport jam segini ada ibu2 nntn video pulitik dengan volume sampe SATU KAFE bs denger tp videonya ngatain gibran. Jd gpp.","1861","953","10205","67320","in","124763180","1750311703806714071","difashfr","https://twitter.com/difashfr/status/1750311703806714071","",""
"Wed Jan 24 13:50:52 +0000 2024","1750154200326221829","wah cocok ya kalau mas gibran tuh di panggil #GusG_bran sesuai yang disematkan oleh Gus Itqon lho gaes https://t.co/aFpN7YBosQ","9","10","8","14","in","1427943087578312708","1750154200326221829","rin_widowati28","https://twitter.com/rin_widowati28/status/1750154200326221829","https://pbs.twimg.com/media/GEnLxKTawAA3o0Z.jpg",""
"Thu Jan 25 05:42:48 +0000 2024","1750393762789163241","Prabowo-Gibran menerima dukungan besar dari INKUD melalui acara konsolidasi dan silaturahmi  serta memberikan bantuan alat genset untuk masyarakat di Jawa Tengah. #PrabowoMenangKoperasiJaya https://t.co/ithT23a2Ag","0","0","9","7","in","1541301842365120512","1750393762789163241","Anggita_Naylin","https://twitter.com/Anggita_Naylin/status/1750393762789163241","https://pbs.twimg.com/media/GEql2M2b0AAe7v_.jpg",""
"Thu Jan 25 05:41:31 +0000 2024","1750393440796643352","Dukungan INKUD kepada Prabowo-Gibran berkomitmen melalui acara konsolidasi dan silaturahmi  serta bantuan alat genset di Jawa Tengah. #PrabowoMenangKoperasiJaya https://t.co/MC5KqvP4Bw","0","0","8","6","in","1541301842365120512","1750393440796643352","Anggita_Naylin","https://twitter.com/Anggita_Naylin/status/1750393440796643352","https://pbs.twimg.com/media/GEqljeLaUAAkrXk.jpg",""
"Thu Jan 25 04:17:47 +0000 2024","1750372368919544061","Prabowo-Gibran makin mentereng.  Yg boneka makin panik dan kecut.  Siapakan kata kotor lg nih program nya.  #PrabowoMenangKoperasiJaya https://t.co/sOtIxfZmCr","0","0","9","7","in","1442246515649433603","1750372368919544061","KimHui_","https://twitter.com/KimHui_/status/1750372368919544061","https://pbs.twimg.com/media/GEqSZKEbkAAV7fp.jpg","Sematang Borang, Indonesia"
"Thu Jan 25 04:19:23 +0000 2024","1750372770146656483","#PrabowoMenangKoperasiJaya Kerena itu jgn ragu dukung Prabowo-Gibran.   Prabowo-Gibran masa depan Indonesia jelas makin jelas. https://t.co/zc7CfNStZN","0","0","4","4","in","1442246515649433603","1750372770146656483","KimHui_","https://twitter.com/KimHui_/status/1750372770146656483","https://pbs.twimg.com/media/GEqSwg2bQAAArxv.jpg","Sematang Borang, Indonesia"
"Thu Jan 25 01:35:01 +0000 2024","1750331406725820771","Gibran duluan yg tuduh @tomlembong bohong soal LFP saat debat  eh begitu Tom Lembong respon balik eh  Luhut ragukan intelektualitas Tom Bahlil sindir kinerja dan tuduh Tom halusinasi Budiman "Burit" tuduh Tom gak ada etika profesi Habiburokhman tuduh Tom cuma jago pidato https://t.co/PKn4MN9E8W","40","154","1545","4845","in","227320530","1750331406725820771","hipohan","https://twitter.com/hipohan/status/1750331406725820771","https://pbs.twimg.com/media/GEptIoZasAA91CQ.jpg",""
"Thu Jan 25 06:05:37 +0000 2024","1750399505537941839","INKUD Jawa Tengah dengan komitmennya mendukung Prabowo-Gibran  menggelar acara konsolidasi dan memberikan bantuan alat genset kepada masyarakat di Jawa Tengah. #PrabowoMenangKoperasiJaya https://t.co/jwVG0VwJ90","0","0","9","6","in","1413689671821893641","1750399505537941839","Septyamaliaa","https://twitter.com/Septyamaliaa/status/1750399505537941839","https://pbs.twimg.com/media/GEqrEZibAAAx-zk.jpg",""
"Thu Jan 25 03:48:35 +0000 2024","1750365018674413811","TERMINAL PANTI  Kab. PASAMAN Mueledaaakkk!!!! ALL IN PRABOWO  #konserindonesiamaju #konserindonesiamajusumbar #ratusikumbang #kintani #rayola #fauzana #ajobuset #ovifristy #prabowo #gibran #prabowopresiden #koalisiindonesiamaju https://t.co/9MQvxde9SZ","2","42","9","42","in","190679407","1750365018674413811","andre_rosiade","https://twitter.com/andre_rosiade/status/1750365018674413811","https://pbs.twimg.com/amplify_video_thumb/1750364862012911616/img/bNQ1axWi-29DdD0r.jpg","Padang, Jakarta"
"Wed Jan 24 09:56:08 +0000 2024","1750095126586929424","Gimana kalian gak kewalahan  orang yang kalian caci dan hina ternyata disayang ulama. Mase Gibran mengaji bersama seluruh jajaran NU  Kyai dan para Bu Nyai (3000 orang).     Yakin  masih bertanya soal adab?  #GIBRAN #KEBUMEN https://t.co/kLJD5wZfOa","49","1354","202","1155","in","576755999","1750095126586929424","bengkeldodo","https://twitter.com/bengkeldodo/status/1750095126586929424","https://pbs.twimg.com/media/GEmVqpragAATsqE.jpg","Kebumen, Indonesia"
"Thu Jan 25 05:42:08 +0000 2024","1750393593922236542","Acara konsolidasi dan silaturahmi yang diselenggarakan oleh INKUD merupakan bentuk dukungan konkret kepada Prabowo-Gibran  dengan memberikan bantuan alat genset di Jawa Tengah. #PrabowoMenangKoperasiJaya https://t.co/2g2lpB9CEO","0","0","9","6","in","1541301842365120512","1750393593922236542","Anggita_Naylin","https://twitter.com/Anggita_Naylin/status/1750393593922236542","https://pbs.twimg.com/media/GEqlsSXaIAANDPR.jpg",""
"Wed Jan 24 23:14:51 +0000 2024","1750296132398223616","Keberadaan Gibran ini menjadi Preseden Buruk bagi demokrasi di Indonesia.... https://t.co/RUdYlzk5O9","8","145","138","546","in","1296312516901916672","1750296132398223616","Bambangmulyonoo","https://twitter.com/Bambangmulyonoo/status/1750296132398223616","https://pbs.twimg.com/ext_tw_video_thumb/1750296027230605312/pu/img/qJcOBo0A_vZ2DVta.jpg",""
"Thu Jan 25 06:04:42 +0000 2024","1750399274536603886","Dengan sukacita  INKUD Jawa Tengah menggelar acara konsolidasi dan memberikan bantuan alat genset sebagai bentuk dukungan kepada Prabowo-Gibran di Jawa Tengah. #PrabowoMenangKoperasiJaya https://t.co/B7IU5zSDuV","0","0","9","5","in","1413689671821893641","1750399274536603886","Septyamaliaa","https://twitter.com/Septyamaliaa/status/1750399274536603886","https://pbs.twimg.com/media/GEqq3Eka0AA1n9F.jpg",""
"Wed Jan 24 12:43:19 +0000 2024","1750137202242437317","Bismillah  per hari ini akun ini akan sy gunakan mempromosikan Paslon 02  Prabowo-Gibran.  Semua paslon adalah anak bangsa terbaik  yg ingin abdikan diri u/ bangsa &amp; negara.  Tentu ada plus minus. Ini soal pilihan. Maaf jk beda pilihan 🙏  Semoga 02 menang  Indonesia makin maju.","51","517","299","1332","in","24893875","1750137202242437317","ferrykoto","https://twitter.com/ferrykoto/status/1750137202242437317","","Kota Surabaya, Jawa Timur"
"Thu Jan 25 05:21:00 +0000 2024","1750388276513615949","Gibran bin Jokowi - Parah https://t.co/nKRTsDQ4bs","4","21","159","343","in","30201110","1750388276513615949","alisyarief","https://twitter.com/alisyarief/status/1750388276513615949","https://pbs.twimg.com/ext_tw_video_thumb/1750388206225469440/pu/img/pQ5Dd6vFf74VPHaR.jpg","-6.252543,106.806343"
"Thu Jan 25 05:42:22 +0000 2024","1750393655737893109","Dengan dukungan Pak De  dan siap turun gunung untuk memenangkan Prabowo Gibran dalam pilpres 2024. Mantapnih Pak De.. 👍 #PrabowoMenangKoperasiJaya https://t.co/AAxVaC56iB","0","1","8","6","in","1502938002791677952","1750393655737893109","borju_1s","https://twitter.com/borju_1s/status/1750393655737893109","https://pbs.twimg.com/media/GEqlwBKbEAAtZLC.jpg",""
"Thu Jan 25 04:47:58 +0000 2024","1750379962107044170","Politikus Muda Perindo Pindah Dukungan ke Prabowo-Gibran  Sebenarnya Perindo kira Pak Jokowi pasti mendukung 03 ternyata salah mau keluar gk enak...anaknya pidato salah sebut nama Prabowo dia senyum2 aja...bisa jd Perindo merestui akar rumput ke 02 setelah menang diajak kerjasama https://t.co/hBhXY3chna","3","45","77","272","in","1211153840122155008","1750379962107044170","alextham878","https://twitter.com/alextham878/status/1750379962107044170","https://pbs.twimg.com/ext_tw_video_thumb/1750371311917101056/pu/img/BfR7Mo0xuvkvvQZB.jpg","Samarinda"
"Wed Jan 24 11:13:44 +0000 2024","1750114658483359748","Mendengar aspirasi dari puluhan ribu warga  nelayan  petani  generasi milennial dan juga para relawan dalam acara Kebumen Bersholawat Untuk Indonesia Maju dan Pembangunan Berkelanjutan. Mohon izin dan doanya  sepakat kita lanjutkan ya pembangunan Indonesia kedepan. Kebumen ❤️✌️ https://t.co/aJf7Gr26Ez","175","1284","660","8105","in","1356478042797797377","1750114658483359748","gibran_tweet","https://twitter.com/gibran_tweet/status/1750114658483359748","https://pbs.twimg.com/media/GEmn_6QbMAAXdWV.jpg",""
"Thu Jan 25 04:00:31 +0000 2024","1750368020520939560","Ndelok Khofifah menjilat Prabowo  sebagai wong Jawa Timur dadi melu isin. Gubernurku koyo wong kesambet.  Prabowo Gibran disamakan sama Sahabat Rosululloh.   Indonesia darurat malu","3","5","42","111","in","1372686617471688705","1750368020520939560","saidi_sudarsono","https://twitter.com/saidi_sudarsono/status/1750368020520939560","",""
"Thu Jan 25 05:53:00 +0000 2024","1750396328830755298","Semakin banyak orang yang percaya dan yakin bahwa Prabowo-Gibran adalah pilihan yang tepat untuk melanjutkan estafet kepemimpinan pak Jokowi. Dukungan mereka terus bertambah dari berbagai kalangan. #PrabowoMenangKoperasiJaya https://t.co/wtClI8PUYr","0","1","9","6","in","1720514749979619328","1750396328830755298","friskasanti_","https://twitter.com/friskasanti_/status/1750396328830755298","https://pbs.twimg.com/media/GEqoLlSaYAArkCJ.jpg",""
"Wed Jan 24 14:22:48 +0000 2024","1750162239108133306","Kecurangan fakta ... Kepala desa sudah diarahkan untuk menangkan Prabowo Gibran https://t.co/m26PXZDC4i","17","13","337","441","in","1129672753651388416","1750162239108133306","H4T14K4LN4L42","https://twitter.com/H4T14K4LN4L42/status/1750162239108133306","https://pbs.twimg.com/ext_tw_video_thumb/1750161801692463104/pu/img/h5QItRnn3rHvtuOd.jpg",""
"Thu Jan 25 04:16:48 +0000 2024","1750372121623351416","Mungkin ada kaitan Jkw merestui Gibran di tarik Prabowo sbagai cawapres  sbb secara matematis basis dukungan ke ganjar tdk akan mampu memenangkan pilpres berhadapan dgn Anies  Berkali2 presiden bilang siap mmpertaruhkan reputasi politiknya demi Indonesia  https://t.co/rPQfUzU4P2","5","39","56","158","in","815290931003826176","1750372121623351416","blantik_pedhet2","https://twitter.com/blantik_pedhet2/status/1750372121623351416","https://pbs.twimg.com/media/GEqSKySbMAAZwFx.jpg","DKI Jakarta, Indonesia"
"Thu Jan 25 05:54:30 +0000 2024","1750396708469780882","Prabowo-Gibran semakin mendapatkan dukungan yang kuat dari berbagai kalangan  menunjukkan bahwa masyarakat percaya dan yakin akan kemampuan mereka dalam melanjutkan estafet kepemimpinan pak Jokowi. #PrabowoMenangKoperasiJaya https://t.co/7Fc2oLj4Xv","0","0","9","6","in","1720514749979619328","1750396708469780882","friskasanti_","https://twitter.com/friskasanti_/status/1750396708469780882","https://pbs.twimg.com/media/GEqohvEbwAAZns0.jpg",""
"Thu Jan 25 05:48:18 +0000 2024","1750395145596567756","@gibran_tweet izin Mas ngikut posenya 🙏  bedanya ini waktu habis dibantai dosen  bukan pas lagi dibantai dosen 😁 https://t.co/hngu4oENt2","91","201","154","5143","in","1083647508604022784","1750392629358207390","dafex30","https://twitter.com/dafex30/status/1750395145596567756","https://pbs.twimg.com/media/GEqnGslbYAAFg6q.jpg",""
"Thu Jan 25 01:18:13 +0000 2024","1750327178070569443","Akhirnya semua akan Prabowo Gibran pada waktunya 🫶🤘  Wakil Ketua Umum Pemuda Perindo(Partai Pendukung 03)DKI Jakarta Calvin Leonardo bersm Pasukan G-anjar Muda(Pagar Muda)menyatakan dukungan Prabowo-Gibran di Pilpres 2024.  Kenyataan itu pahit bro 🤭   https://t.co/Ek8mVJfYla… https://t.co/zCRAz3FFHh","8","27","30","111","in","1469280329093373956","1750327178070569443","selflove_LyN","https://twitter.com/selflove_LyN/status/1750327178070569443","https://pbs.twimg.com/media/GEppSehagAAfCKm.jpg","United States"
"Thu Jan 25 05:31:12 +0000 2024","1750390842349773157","Kubu Ganjar-Mahfud Minta Prabowo-Gibran Mundur dari Jabatannya  TKN Bereaksi: Jangan Nantang-nantang! https://t.co/RHbUkSAxYA","0","108","54","76","in","55507370","1750390842349773157","tvOneNews","https://twitter.com/tvOneNews/status/1750390842349773157","","Pulo Gadung, Indonesia"
"Thu Jan 25 04:41:20 +0000 2024","1750378292547592570","Betul Pak Jokowi  Seorang presiden boleh berkampanye dan memihak  Pak Jokowi harus siap turun gunung' ikut mengkampanyekan pasangan Prabowo Subianto-Gibran Rakabuming Raka' untuk menang terpilih sebagai presiden dan wakil presiden RI. Mantap 👍👍✌️ #PrabowoMenangKoperasiJaya https://t.co/QbeNmTooGC","0","0","11","9","in","1627159829591773184","1750378292547592570","bondankayumanis","https://twitter.com/bondankayumanis/status/1750378292547592570","https://pbs.twimg.com/media/GEqXxdpbMAAQaK8.jpg","DKI Jakarta, Indonesia"
"Wed Jan 24 17:57:18 +0000 2024","1750216217108079049","Ternyata Samsul @gibran_tweet cuma jago menghafal  itu bukan gagasan dr pengetahuannya melainkan......🤦 #DiskualifikasiPaslon2 #GanjarMahfud2024 https://t.co/XQ0gx7gGDM","1","7","5","14","in","852219145701793853","1750216217108079049","arminsunardi","https://twitter.com/arminsunardi/status/1750216217108079049","https://pbs.twimg.com/ext_tw_video_thumb/1750216197763948548/pu/img/TJL7p3kNaHAnEaFh.jpg","Mataram Raya, NTB"
"Thu Jan 25 05:38:35 +0000 2024","1750392702997565739","Inilah saatnya mengembalikan kejayaan Koperasi Unit Desa dengan memilih Prabowo Gibran yg berkomitmen untuk itu. #PrabowoMenangKoperasiJaya https://t.co/lpU9Fp9S0p","0","0","8","5","in","1502938002791677952","1750392702997565739","borju_1s","https://twitter.com/borju_1s/status/1750392702997565739","https://pbs.twimg.com/media/GEqk4iBbEAAP7pS.jpg",""
"Wed Jan 24 12:27:59 +0000 2024","1750133340836130842","Kelihatannya memang sudah panik  karena mencap sebuah pertanyaan itu bodoh tanpa mengecek dulu apa benar begitu adalah kebodohan itu sendiri.   @gibran_tweet sudah sukses membuka kedok politisi senior satu per satu  bahwa selama ini mereka memang lebih banyak pencitraan saja.… https://t.co/88hF1uTbHC","14","199","99","321","in","1003546165105704962","1750133340836130842","DedynurPalakka","https://twitter.com/DedynurPalakka/status/1750133340836130842","https://pbs.twimg.com/ext_tw_video_thumb/1750133277841928193/pu/img/24S4WfnfC9HJp2ZE.jpg","Bali, Indonesia"
"Wed Jan 24 23:51:40 +0000 2024","1750305397301457257","Asli kocak! Yg nyerang duluan itu Gibran padahal.   Giliran pak Tom Lembong ngebales  satu istana kepanasan! 😂  Ini mah mau nyubit orang  tapi giliran dicubit balik ngamuk.  Sabar ya pak @tomlembong. Emang mereka tuh maunya menang sendiri.   Ya maklum  surveynya mandek. 😂","48","78","3140","12960","in","1336114102238760962","1750305397301457257","qalsrama","https://twitter.com/qalsrama/status/1750305397301457257","","Samping Pabrik Nuklir"
"Thu Jan 25 05:55:14 +0000 2024","1750396892666806777","Dukungan kepada Prabowo-Gibran semakin solid dari berbagai kalangan masyarakat. Mereka percaya bahwa Prabowo-Gibran adalah pasangan yang memiliki visi dan komitmen kuat untuk memajukan Indonesia. #PrabowoMenangKoperasiJaya https://t.co/EKqakeKyIF","0","0","6","3","in","1720514749979619328","1750396892666806777","friskasanti_","https://twitter.com/friskasanti_/status/1750396892666806777","https://pbs.twimg.com/media/GEqosWEb0AA_sF8.jpg",""
"Thu Jan 25 04:32:35 +0000 2024","1750376092073152848","Oke gas! "KUD se-Jawa Tengah mendukung pemenangan pasangan 02 Prabowo Gibran. #PrabowoMenangKoperasiJaya https://t.co/17mEdzF3eD","0","0","9","6","in","1627159829591773184","1750376092073152848","bondankayumanis","https://twitter.com/bondankayumanis/status/1750376092073152848","https://pbs.twimg.com/media/GEqVxgqacAAhm1n.jpg","DKI Jakarta, Indonesia"
"Thu Jan 25 01:39:38 +0000 2024","1750332566077690203","Di mana ada mas Gibran di situ ada UMKM.  Muda memimpin 🔥 https://t.co/7e1oXILtX9","4","30","20","160","in","808331288386138112","1750332566077690203","idrisbue","https://twitter.com/idrisbue/status/1750332566077690203","https://pbs.twimg.com/ext_tw_video_thumb/1750332490181726208/pu/img/Ft_0Dbyy6qYo1cgo.jpg","DKI Jakarta, Indonesia"
"Thu Jan 25 05:39:54 +0000 2024","1750393034976747908","Survei LSI diSumbar memenangkan Prabowo Gibran  dengan 49 8% diatas Paslon lainnya. #PrabowoMenangKoperasiJaya https://t.co/YbrpcOjXQH","0","0","7","5","in","1502938002791677952","1750393034976747908","borju_1s","https://twitter.com/borju_1s/status/1750393034976747908","https://pbs.twimg.com/media/GEqlL3daEAA1tZJ.jpg",""
"Wed Jan 24 02:32:48 +0000 2024","1749983561468309868",""Kenapa saya menolak pilih Gibran" versi Bahasa Indo. Silakan ya yg mau repost ke TikTok/Instagram/WA. https://t.co/ljrzOBrz4b","76","44","2749","6907","in","75527601","1749983561468309868","tikaalmira","https://twitter.com/tikaalmira/status/1749983561468309868","https://pbs.twimg.com/media/GEkwxWlWQAE7R6o.jpg","Bogor, Indonesia"
